{
  "$schema": "https://json-schema.org/draft/2020-12/schema",
  "$id": "https://cdn.jsdelivr.net/npm/@ocx-sh/catalog/src/config/schema/catalog.config.schema.json",
  "title": "OCX Catalog Configuration",
  "description": "catalog.config.json — configures an @ocx-sh/catalog deployment (data sources, branding, nav, CI). See src/config/load.ts for the runtime validation contract this schema documents; validation itself is hand-rolled, not ajv-driven.",
  "type": "object",
  "additionalProperties": false,
  "required": ["sources"],
  "dependentRequired": {
    "docsNav": ["docs"]
  },
  "if": {
    "properties": { "chrome": { "const": "ocx" } },
    "required": ["chrome"]
  },
  "then": {
    "properties": { "brand": false, "nav": false, "footer": false, "docsNav": false }
  },
  "else": {
    "required": ["brand"]
  },
  "properties": {
    "$schema": {
      "type": "string",
      "description": "Editor/tooling pointer at this schema. Never read at runtime."
    },
    "configVersion": {
      "const": 1,
      "description": "Forward-compat discriminator. Absent means version 1."
    },
    "sources": {
      "type": "array",
      "minItems": 1,
      "items": { "$ref": "#/$defs/sourceEntry" },
      "allOf": [
        { "contains": { "$ref": "#/$defs/rootSourceEntry" }, "minContains": 0, "maxContains": 1 },
        { "contains": { "$ref": "#/$defs/defaultSourceEntry" }, "minContains": 0, "maxContains": 1 }
      ],
      "description": "One or more index sources this catalog renders (path/url/git, discriminated per entry — see sourceEntry). At most one entry may set root: true, serving that source's wire tree at the site root as well as under index/<label>/. At most one entry may set default: true, the index the catalog view opens on — a separate question from root, and the only way to name a default when no source is root at all. Both checks live in allOf because one schema object can hold only one contains."
    },
    "brand": {
      "$ref": "#/$defs/brand",
      "description": "Site branding: title (required), and optional wordmark/logo. Drives <title>, og:site_name, and the header. Required, except under chrome ocx, where it is rejected."
    },
    "nav": {
      "type": "array",
      "items": { "$ref": "#/$defs/navEntry" },
      "description": "Extra top-nav links, rendered after the built-in Docs entry when docs is set."
    },
    "footer": {
      "$ref": "#/$defs/footer",
      "description": "Footer links, rendered in place of nav[] (a dedicated key, not a reuse of nav[]). The footer always carries a catalog json link to this site's own view model; omit for only that link."
    },
    "docs": {
      "type": "string",
      "minLength": 1,
      "description": "Single docs directory, resolved relative to this file's directory."
    },
    "docsNav": {
      "type": "array",
      "items": { "$ref": "#/$defs/docsNavEntry" },
      "description": "Labelled entries for the docs-mount link(s) in the top nav, replacing the single auto \"docs\" entry. Requires docs to be set. Omit for one auto entry labelled \"docs\" pointing at /docs/."
    },
    "css": {
      "type": "string",
      "minLength": 1,
      "description": "Custom stylesheet, resolved relative to this file's directory. Bundled with the theme's styles (minified, content-hashed), so its relative @import and url() resolve from its own directory."
    },
    "publicDir": {
      "type": "string",
      "minLength": 1,
      "description": "Static assets directory, resolved relative to this file's directory. Copied verbatim into the site's public directory, served at the site root."
    },
    "ci": {
      "$ref": "#/$defs/ci",
      "description": "CI workflow rendering configuration for `ocx-catalog ci` — forge (github/gitlab), package manager, and whether to render the verification job."
    },
    "siteUrl": {
      "type": "string",
      "minLength": 1,
      "description": "Deployment origin (e.g. https://index.ocx.sh), feeding sitemap.hostname and per-page og:url. Must be an absolute http(s) URL — src/config/load.ts validates the shape beyond what this schema (minLength only) expresses."
    },
    "ownerUrl": {
      "$ref": "#/$defs/ownerUrl",
      "description": "Owner-profile link template for the package detail page's owners row: an absolute http(s) URL containing {login} exactly once (e.g. https://gitlab.com/{login}). Omit for https://github.com/{login}. A source's own ownerUrl overrides it for that source's packages. src/config/load.ts additionally requires the template to parse as a URL."
    },
    "description": {
      "type": "string",
      "minLength": 1,
      "description": "Site-wide tagline/meta description, distinct from brand.title."
    },
    "favicon": {
      "type": "string",
      "pattern": "^(?:/(?!/)|https?://)",
      "description": "Href for the browser-tab icon: a site-root-relative path, e.g. /favicon.svg for a favicon.svg shipped via publicDir (joined onto base), or an absolute http(s) URL (used as written). src/config/load.ts also rejects a path with a dot segment. Emitted as <link rel=\"icon\"> on every page, with type derived from the extension (.svg/.png/.ico). Omit for no icon link."
    },
    "base": {
      "type": "string",
      "pattern": "^/(?:(?!\\.{1,2}/)[A-Za-z0-9._-]+/)*$",
      "description": "URL path prefix the site is served under: a leading and trailing /, segments of letters, digits, '.', '_' and '-', no '.' or '..' segment, e.g. /catalog/. Defaults to the path of siteUrl, else /. When siteUrl also carries a path the two must be equal (loader-only check: JSON Schema cannot compare them)."
    },
    "chrome": {
      "enum": ["neutral", "ocx"],
      "description": "EXPERIMENTAL. Page chrome: neutral (default) or the ocx.sh shell. ocx rejects brand, nav, footer and docsNav (the shell owns the header and footer) and makes brand optional."
    }
  },
  "$defs": {
    "sourceEntry": {
      "description": "Exactly one of path | url | git, discriminated by which key is present.",
      "type": "object",
      "oneOf": [
        {
          "type": "object",
          "required": ["path"],
          "additionalProperties": false,
          "properties": {
            "path": { "type": "string", "minLength": 1 },
            "label": { "$ref": "#/$defs/label" },
            "root": { "type": "boolean" },
            "default": { "type": "boolean" },
            "excludeFromAll": { "$ref": "#/$defs/excludeFromAll" },
            "ownerUrl": { "$ref": "#/$defs/sourceOwnerUrl" }
          }
        },
        {
          "type": "object",
          "required": ["url"],
          "additionalProperties": false,
          "properties": {
            "url": {
              "type": "string",
              "minLength": 1,
              "pattern": "^https://",
              "description": "Base URL of a deployed catalog/index instance. https only — /config.json and /c/index.json are the only fetched files that are never digest-verified, so over plain http a network attacker rewrites the enumeration and every downstream digest check then verifies against their digests. src/config/load.ts enforces the same rule with new URL() + a protocol check."
            },
            "label": { "$ref": "#/$defs/label" },
            "root": { "type": "boolean" },
            "default": { "type": "boolean" },
            "excludeFromAll": { "$ref": "#/$defs/excludeFromAll" },
            "ownerUrl": { "$ref": "#/$defs/sourceOwnerUrl" }
          }
        },
        {
          "type": "object",
          "required": ["git"],
          "additionalProperties": false,
          "properties": {
            "git": { "type": "string", "minLength": 1 },
            "ref": { "type": "string", "minLength": 1 },
            "dir": { "type": "string", "minLength": 1 },
            "label": { "$ref": "#/$defs/label" },
            "root": { "type": "boolean" },
            "default": { "type": "boolean" },
            "excludeFromAll": { "$ref": "#/$defs/excludeFromAll" },
            "ownerUrl": { "$ref": "#/$defs/sourceOwnerUrl" }
          }
        }
      ]
    },
    "label": { "type": "string", "minLength": 1 },
    "ownerUrl": {
      "type": "string",
      "minLength": 1,
      "pattern": "^https?://(?:(?!\\{login\\})[\\s\\S])*\\{login\\}(?:(?!\\{login\\})[\\s\\S])*$"
    },
    "sourceOwnerUrl": {
      "$ref": "#/$defs/ownerUrl",
      "description": "Owner-profile link template for this source's package pages, overriding the top-level ownerUrl — same shape: an absolute http(s) URL containing {login} exactly once. Omit to inherit the top-level ownerUrl (else https://github.com/{login})."
    },
    "excludeFromAll": {
      "type": "boolean",
      "description": "Keep this source's packages out of the catalog's \"all\" tab (grid, table, filters, keyword rail and the tab's count). The index keeps its own tab and its package pages still route; the ⌘K command palette still searches it. Omit or false to include it."
    },
    "defaultSourceEntry": {
      "description": "Matches a sources[] entry declaring default: true, for the array-level contains/maxContains check that caps the count at one. minContains: 0 keeps a config with zero default entries legal — the root: true source, if any, is then the default.",
      "type": "object",
      "properties": { "default": { "const": true } },
      "required": ["default"]
    },
    "rootSourceEntry": {
      "description": "Matches a sources[] entry declaring root: true, for the array-level contains/maxContains check that caps the count at one. minContains: 0 keeps a config with zero root entries legal.",
      "type": "object",
      "properties": { "root": { "const": true } },
      "required": ["root"]
    },
    "brand": {
      "type": "object",
      "additionalProperties": false,
      "required": ["title"],
      "properties": {
        "title": { "type": "string", "minLength": 1 },
        "wordmark": {
          "type": "string",
          "minLength": 1,
          "description": "Header wordmark — the text beside the logo in the site header. Omit to show title there too."
        },
        "logo": {
          "type": "string",
          "minLength": 1,
          "description": "Logo asset, relative to this file's directory (a local path, never a URL). Copied into the site's public root and rendered in the header in place of the built-in OCX mark. Omit to keep the built-in OCX mark."
        }
      }
    },
    "navEntry": {
      "type": "object",
      "additionalProperties": false,
      "required": ["text", "link"],
      "properties": {
        "text": { "type": "string", "minLength": 1, "description": "Visible label for this nav entry." },
        "link": {
          "type": "string",
          "minLength": 1,
          "description": "Target href — an http(s) URL or a site-relative path. Validated at config-load time against the same allowlist the theme's safeHref uses before render."
        }
      }
    },
    "docsNavEntry": {
      "type": "object",
      "additionalProperties": false,
      "required": ["text", "link"],
      "properties": {
        "text": { "type": "string", "minLength": 1, "description": "Visible label for this docs-nav entry." },
        "link": {
          "type": "string",
          "minLength": 1,
          "pattern": "^/docs/",
          "description": "Target href — must be \"/docs/\" or start with \"/docs/\"; anything else is a nav[] entry with extra steps."
        }
      }
    },
    "footer": {
      "type": "object",
      "additionalProperties": false,
      "required": ["links"],
      "properties": {
        "links": {
          "type": "array",
          "items": { "$ref": "#/$defs/navEntry" },
          "description": "Footer links, same shape and validation as nav[]."
        }
      }
    },
    "ci": {
      "type": "object",
      "description": "Unknown keys inside ci are ignored (forward-compat) — this is the one object in the config that is NOT additionalProperties: false.",
      "required": ["forge"],
      "properties": {
        "forge": { "type": "string", "enum": ["github", "gitlab"] },
        "packageManager": {
          "type": "string",
          "enum": ["npm", "bun"],
          "default": "npm",
          "description": "Package manager the rendered workflow's install/exec steps use. npm (default) or bun only — pnpm/yarn are unsupported, so a mismatched value is a loud config-load error rather than a silently broken rendered workflow."
        },
        "verifyCi": { "type": "boolean" }
      }
    }
  }
}
